Ether / IP / TCP 140.82.114.22:https > 192.168.0.105:50968 SA
Ether / IP / TCP 192.168.0.105:50968 > 140.82.114.22:https A
Ether / IP / TCP 192.168.0.105:50968 > 140.82.114.22:https PA / Raw
Ether / IP / TCP 140.82.114.22:https > 192.168.0.105:50968 A / Raw
Ether / IP / TCP 192.168.0.105:50968 > 140.82.114.22:https A
Ether / IP / TCP 140.82.114.22:https > 192.168.0.105:50968 A / Raw
Ether / IP / TCP 192.168.0.105:50968 > 140.82.114.22:https A
Ether / IP / TCP 140.82.114.22:https > 192.168.0.105:50968 PA / Raw
Ether / IP / TCP 192.168.0.105:50968 > 140.82.114.22:https A
Ether / IP / TCP 192.168.0.105:50968 > 140.82.114.22:https A / Raw
Ether / IP / TCP 192.168.0.105:50968 > 140.82.114.22:https PA / Raw
Ether / IP / TCP 140.82.114.22:https > 192.168.0.105:50968 A
Ether / IP / TCP 140.82.114.22:https > 192.168.0.105:50968 PA / Raw
Ether / IP / TCP 140.82.114.22:https > 192.168.0.105:50968 PA / Raw
Ether / IP / TCP 192.168.0.105:50968 > 140.82.114.22:https A
Ether / IP / TCP 140.82.114.22:https > 192.168.0.105:50968 PA / Raw
Ether / IP / TCP 140.82.114.22:https > 192.168.0.105:50968 PA / Raw
Ether / IP / TCP 192.168.0.105:50968 > 140.82.114.22:https A
Ether / IP / TCP 140.82.114.22:https > 192.168.0.105:50968 FA
Ether / IP / TCP 192.168.0.105:50968 > 140.82.114.22:https PA / Raw
Ether / IP / TCP 192.168.0.105:50968 > 140.82.114.22:https FA
Ether / IP / TCP 192.168.0.105:38396 > 20.42.65.91:https PA / Raw
Ether / IP / TCP 192.168.0.105:38396 > 20.42.65.91:https A / Raw
Ether / IP / TCP 192.168.0.105:38396 > 20.42.65.91:https PA / Raw
Ether / IP / TCP 140.82.114.22:https > 192.168.0.105:50968 R / Padding
Ether / IP / TCP 20.42.65.91:https > 192.168.0.105:38396 A
Ether / IP / TCP 20.42.65.91:https > 192.168.0.105:38396 PA / Raw
Ether / IP / TCP 192.168.0.105:38396 > 20.42.65.91:https A
Ether / IP / TCP 192.168.0.105:38396 > 20.42.65.91:https PA / Raw
Ether / IP / TCP 20.42.65.91:https > 192.168.0.105:38396 A
Ether / IP / TCP 192.168.0.105:58170 > 199.232.105.32:https A
Ether / IP / TCP 199.232.105.32:https > 192.168.0.105:58170 A
Ether / IP / TCP 192.168.0.145:41694 > 185.125.190.17:http S
Ether / IP / TCP 185.125.190.17:http > 192.168.0.145:41694 SA
Ether / IP / TCP 192.168.0.145:41694 > 185.125.190.17:http A
Ether / IP / TCP 192.168.0.145:41694 > 185.125.190.17:http PA / Raw
Ether / IP / TCP 185.125.190.17:http > 192.168.0.145:41694 FA
Ether / IP / TCP 192.168.0.145:41694 > 185.125.190.17:http A
Ether / IP / TCP 185.125.190.17:http > 192.168.0.145:41694 PA / Raw
Ether / IP / TCP 192.168.0.145:41694 > 185.125.190.17:http A
Ether / IP / TCP 192.168.0.145:41694 > 185.125.190.17:http FA
Ether / IP / TCP 185.125.190.17:http > 192.168.0.145:41694 A
Ether / IP / TCP 192.168.0.145:49066 > 91.189.91.48:http S
Ether / IP / TCP 91.189.91.48:http > 192.168.0.145:49066 SA
Ether / IP / TCP 192.168.0.145:49066 > 91.189.91.48:http A
Ether / IP / TCP 192.168.0.145:49066 > 91.189.91.48:http PA / Raw
Ether / IP / TCP 91.189.91.48:http > 192.168.0.145:49066 PA / Raw
Ether / IP / TCP 192.168.0.145:49066 > 91.189.91.48:http A
Ether / IP / TCP 91.189.91.48:http > 192.168.0.145:49066 FA
Ether / IP / TCP 192.168.0.145:49066 > 91.189.91.48:http FA
Ether / IP / TCP 91.189.91.48:http > 192.168.0.145:49066 A
Ether / IP / TCP 192.168.0.145:52674 > 35.232.111.17:http S
Ether / IP / TCP 35.232.111.17:http > 192.168.0.145:52674 SA
Ether / IP / TCP 192.168.0.145:52674 > 35.232.111.17:http A
Ether / IP / TCP 192.168.0.145:52674 > 35.232.111.17:http PA / Raw
Ether / IP / TCP 35.232.111.17:http > 192.168.0.145:52674 A
Ether / IP / TCP 35.232.111.17:http > 192.168.0.145:52674 PA / Raw
Ether / IP / TCP 192.168.0.145:52674 > 35.232.111.17:http A
Ether / IP / TCP 35.232.111.17:http > 192.168.0.145:52674 FA
Ether / IP / TCP 192.168.0.145:52674 > 35.232.111.17:http FA
Ether / IP / TCP 35.232.111.17:http > 192.168.0.145:52674 A
Ether / IP / TCP 192.168.0.145:48956 > 185.125.190.17:http S
Ether / IP / TCP 185.125.190.17:http > 192.168.0.145:48956 SA
Ether / IP / TCP 192.168.0.145:48956 > 185.125.190.17:http A
Ether / IP / TCP 192.168.0.145:48956 > 185.125.190.17:http PA / Raw
Ether / IP / TCP 185.125.190.17:http > 192.168.0.145:48956 FA
Ether / IP / TCP 192.168.0.145:48956 > 185.125.190.17:http A
Ether / IP / TCP 185.125.190.17:http > 192.168.0.145:48956 PA / Raw
Ether / IP / TCP 192.168.0.145:48956 > 185.125.190.17:http A
Ether / IP / TCP 192.168.0.145:48956 > 185.125.190.17:http FA
Ether / IP / TCP 185.125.190.17:http > 192.168.0.145:48956 A
Ether / IP / TCP 192.168.0.145:40724 > 91.189.91.49:http S
Ether / IP / TCP 91.189.91.49:http > 192.168.0.145:40724 SA
Ether / IP / TCP 192.168.0.145:40724 > 91.189.91.49:http A
Ether / IP / TCP 192.168.0.145:40724 > 91.189.91.49:http PA / Raw
Ether / IP / TCP 91.189.91.49:http > 192.168.0.145:40724 PA / Raw
Ether / IP / TCP 192.168.0.145:40724 > 91.189.91.49:http A
Ether / IP / TCP 91.189.91.49:http > 192.168.0.145:40724 FA
Ether / IP / TCP 192.168.0.145:40724 > 91.189.91.49:http FA
Ether / IP / TCP 91.189.91.49:http > 192.168.0.145:40724 A
Ether / IP / TCP 192.168.0.145:53028 > 185.125.190.18:http S
Ether / IP / TCP 185.125.190.18:http > 192.168.0.145:53028 SA
Ether / IP / TCP 192.168.0.145:53028 > 185.125.190.18:http A
Ether / IP / TCP 192.168.0.145:53028 > 185.125.190.18:http PA / Raw
Ether / IP / TCP 185.125.190.18:http > 192.168.0.145:53028 PA / Raw
Ether / IP / TCP 192.168.0.145:53028 > 185.125.190.18:http A
Ether / IP / TCP 185.125.190.18:http > 192.168.0.145:53028 FA
Ether / IP / TCP 192.168.0.145:53028 > 185.125.190.18:http FA
Ether / IP / TCP 185.125.190.18:http > 192.168.0.145:53028 A
Ether / IP / TCP 192.168.0.145:46986 > 35.224.170.84:http S
Ether / IP / TCP 35.224.170.84:http > 192.168.0.145:46986 SA
Ether / IP / TCP 192.168.0.145:46986 > 35.224.170.84:http A
Ether / IP / TCP 192.168.0.145:46986 > 35.224.170.84:http PA / Raw
Ether / IP / TCP 35.224.170.84:http > 192.168.0.145:46986 A
Ether / IP / TCP 35.224.170.84:http > 192.168.0.145:46986 PA / Raw
Ether / IP / TCP 192.168.0.145:46986 > 35.224.170.84:http A
Ether / IP / TCP 35.224.170.84:http > 192.168.0.145:46986 FA
Ether / IP / TCP 192.168.0.145:46986 > 35.224.170.84:http FA
Ether / IP / TCP 35.224.170.84:http > 192.168.0.145:46986 A
Ether / IP / TCP 192.168.0.145:58430 > 185.125.190.49:http S
Ether / IP / TCP 185.125.190.49:http > 192.168.0.145:58430 SA
Ether / IP / TCP 192.168.0.145:58430 > 185.125.190.49:http A
Ether / IP / TCP 192.168.0.145:58430 > 185.125.190.49:http PA / Raw
Ether / IP / TCP 185.125.190.49:http > 192.168.0.145:58430 PA / Raw
Ether / IP / TCP 192.168.0.145:58430 > 185.125.190.49:http A
Ether / IP / TCP 185.125.190.49:http > 192.168.0.145:58430 FA
Ether / IP / TCP 192.168.0.145:58430 > 185.125.190.49:http FA
Ether / IP / TCP 185.125.190.49:http > 192.168.0.145:58430 A
Ether / IP / TCP 192.168.0.145:44432 > 185.125.190.17:http S
Ether / IP / TCP 185.125.190.17:http > 192.168.0.145:44432 SA
Ether / IP / TCP 192.168.0.145:44432 > 185.125.190.17:http A
Ether / IP / TCP 192.168.0.145:44432 > 185.125.190.17:http PA / Raw
Ether / IP / TCP 185.125.190.17:http > 192.168.0.145:44432 PA / Raw
Ether / IP / TCP 192.168.0.145:44432 > 185.125.190.17:http A
Ether / IP / TCP 185.125.190.17:http > 192.168.0.145:44432 FA
Ether / IP / TCP 192.168.0.145:44432 > 185.125.190.17:http FA
Ether / IP / TCP 185.125.190.17:http > 192.168.0.145:44432 A
Ether / IP / TCP 192.168.0.145:52204 > 185.125.190.18:http S
Ether / IP / TCP 185.125.190.18:http > 192.168.0.145:52204 SA
Ether / IP / TCP 192.168.0.145:52204 > 185.125.190.18:http A
Ether / IP / TCP 192.168.0.145:52204 > 185.125.190.18:http PA / Raw
Ether / IP / TCP 185.125.190.18:http > 192.168.0.145:52204 PA / Raw
Ether / IP / TCP 192.168.0.145:52204 > 185.125.190.18:http A
Ether / IP / TCP 185.125.190.18:http > 192.168.0.145:52204 FA
Ether / IP / TCP 192.168.0.145:52204 > 185.125.190.18:http FA
Ether / IP / TCP 185.125.190.18:http > 192.168.0.145:52204 A
Ether / IP / TCP 192.168.0.145:33326 > 185.125.190.17:http S
Ether / IP / TCP 185.125.190.17:http > 192.168.0.145:33326 SA
Ether / IP / TCP 192.168.0.145:33326 > 185.125.190.17:http A
Ether / IP / TCP 192.168.0.145:33326 > 185.125.190.17:http PA / Raw
Ether / IP / TCP 185.125.190.17:http > 192.168.0.145:33326 PA / Raw
Ether / IP / TCP 192.168.0.145:33326 > 185.125.190.17:http A
Ether / IP / TCP 185.125.190.17:http > 192.168.0.145:33326 FA
Ether / IP / TCP 192.168.0.145:33326 > 185.125.190.17:http FA
Ether / IP / TCP 185.125.190.17:http > 192.168.0.145:33326 A
Ether / IP / TCP 192.168.0.145:55166 > 185.125.190.18:http S
Ether / IP / TCP 185.125.190.18:http > 192.168.0.145:55166 SA
Ether / IP / TCP 192.168.0.145:55166 > 185.125.190.18:http A
Ether / IP / TCP 192.168.0.145:55166 > 185.125.190.18:http PA / Raw
Ether / IP / TCP 185.125.190.18:http > 192.168.0.145:55166 PA / Raw
Ether / IP / TCP 192.168.0.145:55166 > 185.125.190.18:http A
Ether / IP / TCP 185.125.190.18:http > 192.168.0.145:55166 FA
Ether / IP / TCP 192.168.0.145:55166 > 185.125.190.18:http FA
Ether / IP / TCP 185.125.190.18:http > 192.168.0.145:55166 A
Ether / IP / TCP 192.168.0.145:37276 > 185.125.190.17:http S
Ether / IP / TCP 185.125.190.17:http > 192.168.0.145:37276 SA
Ether / IP / TCP 192.168.0.145:37276 > 185.125.190.17:http A
Ether / IP / TCP 192.168.0.145:37276 > 185.125.190.17:http PA / Raw
Ether / IP / TCP 185.125.190.17:http > 192.168.0.145:37276 FA
Ether / IP / TCP 192.168.0.145:37276 > 185.125.190.17:http A
Ether / IP / TCP 185.125.190.17:http > 192.168.0.145:37276 PA / Raw
Ether / IP / TCP 192.168.0.145:37276 > 185.125.190.17:http A
Ether / IP / TCP 192.168.0.145:37276 > 185.125.190.17:http FA
Ether / IP / TCP 185.125.190.17:http > 192.168.0.145:37276 A
Ether / IP / TCP 192.168.0.145:39120 > 35.224.170.84:http S
Ether / IP / TCP 35.224.170.84:http > 192.168.0.145:39120 SA
Ether / IP / TCP 192.168.0.145:39120 > 35.224.170.84:http A
Ether / IP / TCP 192.168.0.145:39120 > 35.224.170.84:http PA / Raw
Ether / IP / TCP 35.224.170.84:http > 192.168.0.145:39120 A
Ether / IP / TCP 35.224.170.84:http > 192.168.0.145:39120 PA / Raw
Ether / IP / TCP 192.168.0.145:39120 > 35.224.170.84:http A
Ether / IP / TCP 35.224.170.84:http > 192.168.0.145:39120 FA
Ether / IP / TCP 192.168.0.145:39120 > 35.224.170.84:http FA
Ether / IP / TCP 35.224.170.84:http > 192.168.0.145:39120 A
Ether / IP / TCP 192.168.0.145:40378 > 91.189.91.49:http S
Ether / IP / TCP 91.189.91.49:http > 192.168.0.145:40378 SA
Ether / IP / TCP 192.168.0.145:40378 > 91.189.91.49:http A
Ether / IP / TCP 192.168.0.145:40378 > 91.189.91.49:http PA / Raw
Ether / IP / TCP 91.189.91.49:http > 192.168.0.145:40378 PA / Raw
Ether / IP / TCP 192.168.0.145:40378 > 91.189.91.49:http A
Ether / IP / TCP 91.189.91.49:http > 192.168.0.145:40378 FA
Ether / IP / TCP 192.168.0.145:40378 > 91.189.91.49:http FA
Ether / IP / TCP 91.189.91.49:http > 192.168.0.145:40378 A
Ether / IP / TCP 192.168.0.145:40090 > 35.244.233.98:https S
Ether / IP / TCP 35.244.233.98:https > 192.168.0.145:40090 SA
Ether / IP / TCP 192.168.0.145:40090 > 35.244.233.98:https A
Ether / IP / TCP 192.168.0.145:40090 > 35.244.233.98:https PA / Raw
Ether / IP / TCP 35.244.233.98:https > 192.168.0.145:40090 A
Ether / IP / TCP 35.244.233.98:https > 192.168.0.145:40090 PA / Raw
Ether / IP / TCP 192.168.0.145:40090 > 35.244.233.98:https A
Ether / IP / TCP 192.168.0.145:40090 > 35.244.233.98:https PA / Raw
Ether / IP / TCP 192.168.0.145:40090 > 35.244.233.98:https PA / Raw
Ether / IP / TCP 192.168.0.145:40090 > 35.244.233.98:https PA / Raw
Ether / IP / TCP 192.168.0.145:40090 > 35.244.233.98:https PA / Raw
Ether / IP / TCP 35.244.233.98:https > 192.168.0.145:40090 PA / Raw
Ether / IP / TCP 35.244.233.98:https > 192.168.0.145:40090 PA / Raw
Ether / IP / TCP 192.168.0.145:40090 > 35.244.233.98:https A
Ether / IP / TCP 192.168.0.145:40090 > 35.244.233.98:https PA / Raw
Ether / IP / TCP 35.244.233.98:https > 192.168.0.145:40090 A
Ether / IP / TCP 35.244.233.98:https > 192.168.0.145:40090 A
Ether / IP / TCP 35.244.233.98:https > 192.168.0.145:40090 A
Ether / IP / TCP 192.168.0.145:43534 > 142.250.196.78:https S
Ether / IP / TCP 142.250.196.78:https > 192.168.0.145:43534 SA
Ether / IP / TCP 192.168.0.145:43534 > 142.250.196.78:https A
Ether / IP / TCP 192.168.0.145:43534 > 142.250.196.78:https PA / Raw
Ether / IP / TCP 142.250.196.78:https > 192.168.0.145:43534 A
Ether / IP / TCP 142.250.196.78:https > 192.168.0.145:43534 PA / Raw
Ether / IP / TCP 192.168.0.145:43534 > 142.250.196.78:https A
Ether / IP / TCP 192.168.0.145:43534 > 142.250.196.78:https PA / Raw
Ether / IP / TCP 192.168.0.145:43534 > 142.250.196.78:https PA / Raw
Ether / IP / TCP 192.168.0.145:43534 > 142.250.196.78:https PA / Raw
Ether / IP / TCP 192.168.0.145:43534 > 142.250.196.78:https PA / Raw
Ether / IP / TCP 142.250.196.78:https > 192.168.0.145:43534 PA / Raw
Ether / IP / TCP 142.250.196.78:https > 192.168.0.145:43534 PA / Raw
Ether / IP / TCP 192.168.0.145:43534 > 142.250.196.78:https A
Ether / IP / TCP 192.168.0.145:43534 > 142.250.196.78:https A / Raw
Ether / IP / TCP 192.168.0.145:43534 > 142.250.196.78:https PA / Raw
Ether / IP / TCP 142.250.196.78:https > 192.168.0.145:43534 A
Ether / IP / TCP 192.168.0.145:43534 > 142.250.196.78:https PA / Raw
Ether / IP / TCP 142.250.196.78:https > 192.168.0.145:43534 A
Ether / IP / TCP 192.168.0.145:43534 > 142.250.196.78:https PA / Raw
Ether / IP / TCP 142.250.196.78:https > 192.168.0.145:43534 A
Ether / IP / TCP 192.168.0.145:43534 > 142.250.196.78:https PA / Raw
Ether / IP / TCP 142.250.196.78:https > 192.168.0.145:43534 A
Ether / IP / TCP 192.168.0.145:43534 > 142.250.196.78:https PA / Raw
Ether / IP / TCP 142.250.196.78:https > 192.168.0.145:43534 A
Ether / IP / TCP 192.168.0.145:43534 > 142.250.196.78:https PA / Raw
Ether / IP / TCP 142.250.196.78:https > 192.168.0.145:43534 A
Ether / IP / TCP 192.168.0.145:43534 > 142.250.196.78:https PA / Raw
Ether / IP / TCP 142.250.196.78:https > 192.168.0.145:43534 A
Ether / IP / TCP 192.168.0.145:43534 > 142.250.196.78:https PA / Raw
Ether / IP / TCP 142.250.196.78:https > 192.168.0.145:43534 A
Ether / IP / TCP 192.168.0.145:43534 > 142.250.196.78:https PA / Raw
Ether / IP / TCP 142.250.196.78:https > 192.168.0.145:43534 A
Ether / IP / TCP 142.250.196.78:https > 192.168.0.145:43534 A
Ether / IP / TCP 192.168.0.145:43534 > 142.250.196.78:https PA / Raw
Ether / IP / TCP 142.250.196.78:https > 192.168.0.145:43534 A
Ether / IP / TCP 192.168.0.145:43534 > 142.250.196.78:https PA / Raw
Ether / IP / TCP 192.168.0.145:43534 > 142.250.196.78:https PA / Raw
Ether / IP / TCP 142.250.196.78:https > 192.168.0.145:43534 A
Ether / IP / TCP 142.250.196.78:https > 192.168.0.145:43534 A
Ether / IP / TCP 192.168.0.145:43534 > 142.250.196.78:https PA / Raw
Ether / IP / TCP 142.250.196.78:https > 192.168.0.145:43534 PA / Raw
Ether / IP / TCP 142.250.196.78:https > 192.168.0.145:43534 A
Ether / IP / TCP 142.250.196.78:https > 192.168.0.145:43534 A
Ether / IP / TCP 142.250.196.78:https > 192.168.0.145:43534 A
Ether / IP / TCP 192.168.0.145:43534 > 142.250.196.78:https PA / Raw
Ether / IP / TCP 142.250.196.78:https > 192.168.0.145:43534 A
Ether / IP / TCP 142.250.196.78:https > 192.168.0.145:43534 A
Ether / IP / TCP 142.250.196.78:https > 192.168.0.145:43534 A
Ether / IP / TCP 142.250.196.78:https > 192.168.0.145:43534 A
Ether / IP / TCP 142.250.196.78:https > 192.168.0.145:43534 A
Ether / IP / TCP 192.168.0.145:43534 > 142.250.196.78:https PA / Raw
Ether / IP / TCP 142.250.196.78:https > 192.168.0.145:43534 A
Ether / IP / TCP 192.168.0.145:43534 > 142.250.196.78:https PA / Raw
Ether / IP / TCP 142.250.196.78:https > 192.168.0.145:43534 A
Ether / IP / TCP 142.250.196.78:https > 192.168.0.145:43534 A
Ether / IP / TCP 142.250.196.78:https > 192.168.0.145:43534 A
Ether / IP / TCP 142.250.196.78:https > 192.168.0.145:43534 A
Ether / IP / TCP 142.250.196.78:https > 192.168.0.145:43534 A
Ether / IP / TCP 192.168.0.145:43534 > 142.250.196.78:https PA / Raw
Ether / IP / TCP 142.250.196.78:https > 192.168.0.145:43534 A
Ether / IP / TCP 142.250.196.78:https > 192.168.0.145:43534 A
Ether / IP / TCP 142.250.196.78:https > 192.168.0.145:43534 A
Ether / IP / TCP 142.250.196.78:https > 192.168.0.145:43534 A
Ether / IP / TCP 142.250.196.78:https > 192.168.0.145:43534 A
Ether / IP / TCP 142.250.196.78:https > 192.168.0.145:43534 A
Ether / IP / TCP 142.250.196.78:https > 192.168.0.145:43534 A
Ether / IP / TCP 142.250.196.78:https > 192.168.0.145:43534 A
Ether / IP / TCP 142.250.196.78:https > 192.168.0.145:43534 A
Ether / IP / TCP 142.250.196.78:https > 192.168.0.145:43534 A
Ether / IP / TCP 142.250.196.78:https > 192.168.0.145:43534 A
Ether / IP / TCP 142.250.196.78:https > 192.168.0.145:43534 A
Ether / IP / TCP 142.250.196.78:https > 192.168.0.145:43534 A
Ether / IP / TCP 142.250.196.78:https > 192.168.0.145:43534 A
Ether / IP / TCP 142.250.196.78:https > 192.168.0.145:43534 A
Ether / IP / TCP 142.250.196.78:https > 192.168.0.145:43534 A
Ether / IP / TCP 35.244.233.98:https > 192.168.0.145:40090 PA / Raw
Ether / IP / TCP 35.244.233.98:https > 192.168.0.145:40090 PA / Raw
Ether / IP / TCP 192.168.0.145:40090 > 35.244.233.98:https A
Ether / IP / TCP 35.244.233.98:https > 192.168.0.145:40090 PA / Raw
Ether / IP / TCP 35.244.233.98:https > 192.168.0.145:40090 PA / Raw
Ether / IP / TCP 192.168.0.145:40090 > 35.244.233.98:https A
Ether / IP / TCP 192.168.0.145:40090 > 35.244.233.98:https PA / Raw
Ether / IP / TCP 35.244.233.98:https > 192.168.0.145:40090 A
Ether / IP / TCP 192.168.0.145:56262 > 35.244.180.134:https S
Ether / IP / TCP 35.244.180.134:https > 192.168.0.145:56262 SA
Ether / IP / TCP 192.168.0.145:56262 > 35.244.180.134:https A
Ether / IP / TCP 192.168.0.145:56262 > 35.244.180.134:https PA / Raw
Ether / IP / TCP 35.244.180.134:https > 192.168.0.145:56262 A
Ether / IP / TCP 35.244.180.134:https > 192.168.0.145:56262 PA / Raw
Ether / IP / TCP 192.168.0.145:56262 > 35.244.180.134:https A
Ether / IP / TCP 192.168.0.145:56262 > 35.244.180.134:https PA / Raw
Ether / IP / TCP 35.244.180.134:https > 192.168.0.145:56262 PA / Raw
Ether / IP / TCP 192.168.0.145:56262 > 35.244.180.134:https A
Ether / IP / TCP 142.250.196.78:https > 192.168.0.145:43534 PA / Raw
Ether / IP / TCP 192.168.0.145:43534 > 142.250.196.78:https A
Ether / IP / TCP 142.250.196.78:https > 192.168.0.145:43534 PA / Raw
Ether / IP / TCP 192.168.0.145:43534 > 142.250.196.78:https A
Ether / IP / TCP 142.250.196.78:https > 192.168.0.145:43534 PA / Raw
Ether / IP / TCP 142.250.196.78:https > 192.168.0.145:43534 PA / Raw
Ether / IP / TCP 142.250.196.78:https > 192.168.0.145:43534 PA / Raw
Ether / IP / TCP 192.168.0.145:43534 > 142.250.196.78:https A
Ether / IP / TCP 192.168.0.145:43534 > 142.250.196.78:https PA / Raw
Ether / IP / TCP 142.250.196.78:https > 192.168.0.145:43534 A
Ether / IP / TCP 142.250.196.78:https > 192.168.0.145:43534 PA / Raw
Ether / IP / TCP 142.250.196.78:https > 192.168.0.145:43534 PA / Raw
Ether / IP / TCP 142.250.196.78:https > 192.168.0.145:43534 PA / Raw
Ether / IP / TCP 142.250.196.78:https > 192.168.0.145:43534 PA / Raw
Ether / IP / TCP 192.168.0.145:43534 > 142.250.196.78:https A
Ether / IP / TCP 192.168.0.145:43534 > 142.250.196.78:https PA / Raw
Ether / IP / TCP 142.250.196.78:https > 192.168.0.145:43534 A
Ether / IP / TCP 142.250.196.78:https > 192.168.0.145:43534 PA / Raw
Ether / IP / TCP 142.250.196.78:https > 192.168.0.145:43534 PA / Raw
Ether / IP / TCP 142.250.196.78:https > 192.168.0.145:43534 PA / Raw
Ether / IP / TCP 142.250.196.78:https > 192.168.0.145:43534 PA / Raw
Ether / IP / TCP 142.250.196.78:https > 192.168.0.145:43534 PA / Raw
Ether / IP / TCP 192.168.0.145:43534 > 142.250.196.78:https A
Ether / IP / TCP 192.168.0.145:43534 > 142.250.196.78:https PA / Raw
Ether / IP / TCP 192.168.0.145:43534 > 142.250.196.78:https PA / Raw
Ether / IP / TCP 142.250.196.78:https > 192.168.0.145:43534 A
Ether / IP / TCP 142.250.196.78:https > 192.168.0.145:43534 A
Ether / IP / TCP 192.168.0.145:40090 > 35.244.233.98:https PA / Raw
Ether / IP / TCP 192.168.0.145:40090 > 35.244.233.98:https PA / Raw
Ether / IP / TCP 35.244.233.98:https > 192.168.0.145:40090 A
Ether / IP / TCP 35.244.233.98:https > 192.168.0.145:40090 A
Ether / IP / TCP 35.244.233.98:https > 192.168.0.145:40090 A
Ether / IP / TCP 35.244.233.98:https > 192.168.0.145:40090 A
Ether / IP / TCP 192.168.0.145:39882 > 20.42.65.90:https S
Ether / IP / TCP 142.250.196.78:https > 192.168.0.145:43534 PA / Raw
Ether / IP / TCP 142.250.196.78:https > 192.168.0.145:43534 PA / Raw
Ether / IP / TCP 192.168.0.145:43534 > 142.250.196.78:https A
Ether / IP / TCP 142.250.196.78:https > 192.168.0.145:43534 PA / Raw
Ether / IP / TCP 142.250.196.78:https > 192.168.0.145:43534 PA / Raw
Ether / IP / TCP 192.168.0.145:43534 > 142.250.196.78:https A
Ether / IP / TCP 192.168.0.145:43534 > 142.250.196.78:https PA / Raw
Ether / IP / TCP 192.168.0.145:43534 > 142.250.196.78:https PA / Raw
Ether / IP / TCP 142.250.196.78:https > 192.168.0.145:43534 A
Ether / IP / TCP 142.250.196.78:https > 192.168.0.145:43534 A
Ether / IP / TCP 20.42.65.90:https > 192.168.0.145:39882 SA
Ether / IP / TCP 192.168.0.145:39882 > 20.42.65.90:https A
Ether / IP / TCP 192.168.0.145:39882 > 20.42.65.90:https PA / Raw
Ether / IP / TCP 20.42.65.90:https > 192.168.0.145:39882 A / Raw
Ether / IP / TCP 192.168.0.145:39882 > 20.42.65.90:https A
Ether / IP / TCP 20.42.65.90:https > 192.168.0.145:39882 PA / Raw
Ether / IP / TCP 192.168.0.145:39882 > 20.42.65.90:https A
Ether / IP / TCP 20.42.65.90:https > 192.168.0.145:39882 A / Raw
Ether / IP / TCP 192.168.0.145:39882 > 20.42.65.90:https A
Ether / IP / TCP 192.168.0.145:39882 > 20.42.65.90:https PA / Raw
Ether / IP / TCP 192.168.0.145:39882 > 20.42.65.90:https PA / Raw
Ether / IP / TCP 192.168.0.145:39882 > 20.42.65.90:https PA / Raw
Ether / IP / TCP 35.244.233.98:https > 192.168.0.145:40090 PA / Raw
Ether / IP / TCP 35.244.233.98:https > 192.168.0.145:40090 PA / Raw
Ether / IP / TCP 35.244.233.98:https > 192.168.0.145:40090 PA / Raw
Ether / IP / TCP 192.168.0.145:40090 > 35.244.233.98:https A
Ether / IP / TCP 35.244.233.98:https > 192.168.0.145:40090 PA / Raw
Ether / IP / TCP 192.168.0.145:40090 > 35.244.233.98:https A
Ether / IP / TCP 35.244.233.98:https > 192.168.0.145:40090 PA / Raw
Ether / IP / TCP 35.244.233.98:https > 192.168.0.145:40090 PA / Raw
Ether / IP / TCP 192.168.0.145:40090 > 35.244.233.98:https A
Ether / IP / TCP 192.168.0.145:40090 > 35.244.233.98:https PA / Raw
Ether / IP / TCP 35.244.233.98:https > 192.168.0.145:40090 A
Ether / IP / TCP 192.168.0.145:40090 > 35.244.233.98:https PA / Raw
Ether / IP / TCP 192.168.0.145:40090 > 35.244.233.98:https PA / Raw
Ether / IP / TCP 20.42.65.90:https > 192.168.0.145:39882 A
Ether / IP / TCP 20.42.65.90:https > 192.168.0.145:39882 PA / Raw
Ether / IP / TCP 20.42.65.90:https > 192.168.0.145:39882 PA / Raw
Ether / IP / TCP 192.168.0.145:39882 > 20.42.65.90:https A
Ether / IP / TCP 20.42.65.90:https > 192.168.0.145:39882 PA / Raw
Ether / IP / TCP 192.168.0.145:39882 > 20.42.65.90:https PA / Raw
Ether / IP / TCP 35.244.233.98:https > 192.168.0.145:40090 A
Ether / IP / TCP 35.244.233.98:https > 192.168.0.145:40090 A
Ether / IP / TCP 35.244.233.98:https > 192.168.0.145:40090 A
Ether / IP / TCP 35.244.233.98:https > 192.168.0.145:40090 A
Ether / IP / TCP 192.168.0.145:39882 > 20.42.65.90:https A
Ether / IP / TCP 192.168.0.145:56264 > 35.244.180.134:https S
Ether / IP / TCP 35.244.180.134:https > 192.168.0.145:56264 SA
Ether / IP / TCP 192.168.0.145:56264 > 35.244.180.134:https A
Ether / IP / TCP 192.168.0.145:56264 > 35.244.180.134:https PA / Raw
Ether / IP / TCP 35.244.180.134:https > 192.168.0.145:56264 A
Ether / IP / TCP 35.244.180.134:https > 192.168.0.145:56264 PA / Raw
Ether / IP / TCP 192.168.0.145:56264 > 35.244.180.134:https A
Ether / IP / TCP 192.168.0.145:56264 > 35.244.180.134:https PA / Raw
Ether / IP / TCP 192.168.0.145:56264 > 35.244.180.134:https PA / Raw
Ether / IP / TCP 192.168.0.145:56264 > 35.244.180.134:https PA / Raw
Ether / IP / TCP 35.244.180.134:https > 192.168.0.145:56264 PA / Raw
Ether / IP / TCP 192.168.0.145:56264 > 35.244.180.134:https PA / Raw
Ether / IP / TCP 35.244.180.134:https > 192.168.0.145:56264 PA / Raw
Ether / IP / TCP 35.244.180.134:https > 192.168.0.145:56264 A
Ether / IP / TCP 35.244.180.134:https > 192.168.0.145:56264 A
Ether / IP / TCP 192.168.0.145:56264 > 35.244.180.134:https A
Ether / IP / TCP 20.42.65.90:https > 192.168.0.145:39882 PA / Raw
Ether / IP / TCP 192.168.0.145:39882 > 20.42.65.90:https A
Ether / IP / TCP 20.42.65.90:https > 192.168.0.145:39882 A
Ether / IP / TCP 35.244.180.134:https > 192.168.0.145:56264 PA / Raw
Ether / IP / TCP 192.168.0.145:56264 > 35.244.180.134:https A
Ether / IP / TCP 35.244.180.134:https > 192.168.0.145:56264 PA / Raw
Ether / IP / TCP 192.168.0.145:56264 > 35.244.180.134:https A
Ether / IP / TCP 35.244.180.134:https > 192.168.0.145:56264 PA / Raw
Ether / IP / TCP 192.168.0.145:56264 > 35.244.180.134:https A
Ether / IP / TCP 35.244.180.134:https > 192.168.0.145:56264 PA / Raw
Ether / IP / TCP 192.168.0.145:56264 > 35.244.180.134:https A
Ether / IP / TCP 192.168.0.145:56264 > 35.244.180.134:https PA / Raw
Ether / IP / TCP 35.244.180.134:https > 192.168.0.145:56264 PA / Raw
Ether / IP / TCP 192.168.0.145:56264 > 35.244.180.134:https A
Ether / IP / TCP 35.244.180.134:https > 192.168.0.145:56264 A
Ether / IP / TCP 35.244.233.98:https > 192.168.0.145:40090 PA / Raw
Ether / IP / TCP 35.244.233.98:https > 192.168.0.145:40090 PA / Raw
Ether / IP / TCP 192.168.0.145:40090 > 35.244.233.98:https A
Ether / IP / TCP 35.244.233.98:https > 192.168.0.145:40090 PA / Raw
Ether / IP / TCP 35.244.233.98:https > 192.168.0.145:40090 PA / Raw
Ether / IP / TCP 192.168.0.145:40090 > 35.244.233.98:https A
Ether / IP / TCP 192.168.0.145:40090 > 35.244.233.98:https PA / Raw
Ether / IP / TCP 35.244.233.98:https > 192.168.0.145:40090 A
Ether / IP / TCP 192.168.0.145:39882 > 20.42.65.90:https PA / Raw
Ether / IP / TCP 192.168.0.145:39882 > 20.42.65.90:https PA / Raw
Ether / IP / TCP 20.42.65.90:https > 192.168.0.145:39882 A
Ether / IP / TCP 20.42.65.90:https > 192.168.0.145:39882 PA / Raw
Ether / IP / TCP 192.168.0.145:39882 > 20.42.65.90:https A
Ether / IP / TCP 192.168.0.145:53114 > 142.250.183.234:https S
Ether / IP / TCP 142.250.183.234:https > 192.168.0.145:53114 SA
Ether / IP / TCP 192.168.0.145:53114 > 142.250.183.234:https A
Ether / IP / TCP 192.168.0.145:53114 > 142.250.183.234:https PA / Raw
Ether / IP / TCP 142.250.183.234:https > 192.168.0.145:53114 A
Ether / IP / TCP 142.250.183.234:https > 192.168.0.145:53114 A / Raw
Ether / IP / TCP 192.168.0.145:53114 > 142.250.183.234:https A
Ether / IP / TCP 142.250.183.234:https > 192.168.0.145:53114 PA / Raw
Ether / IP / TCP 192.168.0.145:53114 > 142.250.183.234:https A
Ether / IP / TCP 142.250.183.234:https > 192.168.0.145:53114 PA / Raw
Ether / IP / TCP 192.168.0.145:53114 > 142.250.183.234:https A
Ether / IP / TCP 142.250.183.234:https > 192.168.0.145:53114 A / Raw
Ether / IP / TCP 192.168.0.145:53114 > 142.250.183.234:https A
Ether / IP / TCP 142.250.183.234:https > 192.168.0.145:53114 A / Raw
Ether / IP / TCP 192.168.0.145:53114 > 142.250.183.234:https A
Ether / IP / TCP 142.250.183.234:https > 192.168.0.145:53114 PA / Raw
Ether / IP / TCP 192.168.0.145:53114 > 142.250.183.234:https A
Ether / IP / TCP 142.250.183.234:https > 192.168.0.145:53114 A / Raw
Ether / IP / TCP 192.168.0.145:53114 > 142.250.183.234:https A
Ether / IP / TCP 192.168.0.145:53114 > 142.250.183.234:https PA / Raw
Ether / IP / TCP 192.168.0.145:53114 > 142.250.183.234:https PA / Raw
Ether / IP / TCP 192.168.0.145:53114 > 142.250.183.234:https PA / Raw
Ether / IP / TCP 142.250.183.234:https > 192.168.0.145:53114 A / Raw
Ether / IP / TCP 192.168.0.145:53114 > 142.250.183.234:https A
Ether / IP / TCP 142.250.183.234:https > 192.168.0.145:53114 A / Raw
Ether / IP / TCP 192.168.0.145:53114 > 142.250.183.234:https A
Ether / IP / TCP 142.250.183.234:https > 192.168.0.145:53114 PA / Raw
Ether / IP / TCP 192.168.0.145:53114 > 142.250.183.234:https A
Ether / IP / TCP 142.250.183.234:https > 192.168.0.145:53114 PA / Raw
Ether / IP / TCP 192.168.0.145:53114 > 142.250.183.234:https A
Ether / IP / TCP 192.168.0.145:53114 > 142.250.183.234:https PA / Raw
Ether / IP / TCP 142.250.183.234:https > 192.168.0.145:53114 A
Ether / IP / TCP 142.250.183.234:https > 192.168.0.145:53114 A
Ether / IP / TCP 142.250.183.234:https > 192.168.0.145:53114 PA / Raw
Ether / IP / TCP 142.250.183.234:https > 192.168.0.145:53114 PA / Raw
Ether / IP / TCP 142.250.183.234:https > 192.168.0.145:53114 PA / Raw
Ether / IP / TCP 142.250.183.234:https > 192.168.0.145:53114 PA / Raw
Ether / IP / TCP 192.168.0.145:53114 > 142.250.183.234:https A
Ether / IP / TCP 192.168.0.145:53126 > 142.250.183.234:https S
Ether / IP / TCP 192.168.0.145:53114 > 142.250.183.234:https PA / Raw
Ether / IP / TCP 142.250.183.234:https > 192.168.0.145:53126 SA
Ether / IP / TCP 192.168.0.145:53126 > 142.250.183.234:https A
Ether / IP / TCP 192.168.0.145:53126 > 142.250.183.234:https PA / Raw
Ether / IP / TCP 142.250.183.234:https > 192.168.0.145:53114 A
Ether / IP / TCP 142.250.183.234:https > 192.168.0.145:53126 A
Ether / IP / TCP 142.250.183.234:https > 192.168.0.145:53126 A / Raw
Ether / IP / TCP 192.168.0.145:53126 > 142.250.183.234:https A
Ether / IP / TCP 142.250.183.234:https > 192.168.0.145:53126 A / Raw
Ether / IP / TCP 192.168.0.145:53126 > 142.250.183.234:https A
Ether / IP / TCP 142.250.183.234:https > 192.168.0.145:53126 A / Raw
Ether / IP / TCP 192.168.0.145:53126 > 142.250.183.234:https A
Ether / IP / TCP 142.250.183.234:https > 192.168.0.145:53126 PA / Raw
Ether / IP / TCP 192.168.0.145:53126 > 142.250.183.234:https A
Ether / IP / TCP 142.250.183.234:https > 192.168.0.145:53126 A / Raw
Ether / IP / TCP 192.168.0.145:53126 > 142.250.183.234:https A
Ether / IP / TCP 142.250.183.234:https > 192.168.0.145:53126 PA / Raw
Ether / IP / TCP 192.168.0.145:53126 > 142.250.183.234:https A
Ether / IP / TCP 142.250.183.234:https > 192.168.0.145:53126 A / Raw
Ether / IP / TCP 192.168.0.145:53126 > 142.250.183.234:https A
Ether / IP / TCP 142.250.183.234:https > 192.168.0.145:53126 PA / Raw
Ether / IP / TCP 192.168.0.145:53126 > 142.250.183.234:https A
Ether / IP / TCP 192.168.0.145:53126 > 142.250.183.234:https PA / Raw
Ether / IP / TCP 192.168.0.145:53126 > 142.250.183.234:https PA / Raw
Ether / IP / TCP 192.168.0.145:53126 > 142.250.183.234:https PA / Raw
Ether / IP / TCP 192.168.0.145:53126 > 142.250.183.234:https PA / Raw
Ether / IP / TCP 142.250.183.234:https > 192.168.0.145:53126 PA / Raw
Ether / IP / TCP 192.168.0.145:53126 > 142.250.183.234:https A
Ether / IP / TCP 142.250.183.234:https > 192.168.0.145:53126 PA / Raw
Ether / IP / TCP 192.168.0.145:53126 > 142.250.183.234:https A
Ether / IP / TCP 142.250.183.234:https > 192.168.0.145:53126 PA / Raw
Ether / IP / TCP 192.168.0.145:53126 > 142.250.183.234:https A
Ether / IP / TCP 192.168.0.145:53126 > 142.250.183.234:https PA / Raw
Ether / IP / TCP 142.250.183.234:https > 192.168.0.145:53126 A
Ether / IP / TCP 142.250.183.234:https > 192.168.0.145:53126 A
Ether / IP / TCP 142.250.183.234:https > 192.168.0.145:53126 A
Ether / IP / TCP 142.250.183.234:https > 192.168.0.145:53126 PA / Raw
Ether / IP / TCP 142.250.183.234:https > 192.168.0.145:53126 PA / Raw
Ether / IP / TCP 142.250.183.234:https > 192.168.0.145:53126 PA / Raw
Ether / IP / TCP 192.168.0.145:53126 > 142.250.183.234:https A
Ether / IP / TCP 142.250.183.234:https > 192.168.0.145:53126 PA / Raw
Ether / IP / TCP 142.250.183.234:https > 192.168.0.145:53126 PA / Raw
Ether / IP / TCP 192.168.0.145:53126 > 142.250.183.234:https A
Ether / IP / TCP 192.168.0.145:46928 > 35.244.180.134:https S
Ether / IP / TCP 35.244.180.134:https > 192.168.0.145:46928 SA
Ether / IP / TCP 192.168.0.145:46928 > 35.244.180.134:https A
Ether / IP / TCP 192.168.0.145:46928 > 35.244.180.134:https PA / Raw
Ether / IP / TCP 35.244.180.134:https > 192.168.0.145:46928 A
Ether / IP / TCP 35.244.180.134:https > 192.168.0.145:46928 PA / Raw
Ether / IP / TCP 192.168.0.145:46928 > 35.244.180.134:https A
Ether / IP / TCP 192.168.0.145:46928 > 35.244.180.134:https PA / Raw
Ether / IP / TCP 192.168.0.145:46928 > 35.244.180.134:https PA / Raw
Ether / IP / TCP 192.168.0.145:46928 > 35.244.180.134:https PA / Raw
Ether / IP / TCP 35.244.180.134:https > 192.168.0.145:46928 PA / Raw
Ether / IP / TCP 192.168.0.145:46928 > 35.244.180.134:https PA / Raw
Ether / IP / TCP 35.244.180.134:https > 192.168.0.145:46928 PA / Raw
Ether / IP / TCP 35.244.180.134:https > 192.168.0.145:46928 A
Ether / IP / TCP 35.244.180.134:https > 192.168.0.145:46928 A
Ether / IP / TCP 192.168.0.145:46928 > 35.244.180.134:https A
Ether / IP / TCP 35.244.180.134:https > 192.168.0.145:46928 PA / Raw
Ether / IP / TCP 192.168.0.145:46928 > 35.244.180.134:https A
Ether / IP / TCP 35.244.180.134:https > 192.168.0.145:46928 PA / Raw
Ether / IP / TCP 192.168.0.145:46928 > 35.244.180.134:https A
Ether / IP / TCP 35.244.180.134:https > 192.168.0.145:46928 PA / Raw
Ether / IP / TCP 192.168.0.145:46928 > 35.244.180.134:https A
Ether / IP / TCP 35.244.180.134:https > 192.168.0.145:46928 PA / Raw
Ether / IP / TCP 192.168.0.145:46928 > 35.244.180.134:https A
Ether / IP / TCP 35.244.180.134:https > 192.168.0.145:46928 PA / Raw
Ether / IP / TCP 192.168.0.145:46928 > 35.244.180.134:https A
Ether / IP / TCP 35.244.180.134:https > 192.168.0.145:46928 PA / Raw
Ether / IP / TCP 192.168.0.145:46928 > 35.244.180.134:https A
Ether / IP / TCP 35.244.180.134:https > 192.168.0.145:46928 PA / Raw
Ether / IP / TCP 192.168.0.145:46928 > 35.244.180.134:https A
Ether / IP / TCP 192.168.0.145:46928 > 35.244.180.134:https PA / Raw
Ether / IP / TCP 192.168.0.145:46928 > 35.244.180.134:https PA / Raw
Ether / IP / TCP 35.244.180.134:https > 192.168.0.145:46928 A
Ether / IP / TCP 35.244.180.134:https > 192.168.0.145:46928 A
Ether / IP / TCP 35.244.180.134:https > 192.168.0.145:46928 PA / Raw
Ether / IP / TCP 35.244.180.134:https > 192.168.0.145:46928 PA / Raw
Ether / IP / TCP 192.168.0.145:46928 > 35.244.180.134:https A
Ether / IP / TCP 35.244.180.134:https > 192.168.0.145:46928 PA / Raw
Ether / IP / TCP 35.244.180.134:https > 192.168.0.145:46928 PA / Raw
Ether / IP / TCP 35.244.180.134:https > 192.168.0.145:46928 PA / Raw
Ether / IP / TCP 35.244.180.134:https > 192.168.0.145:46928 PA / Raw
Ether / IP / TCP 35.244.180.134:https > 192.168.0.145:46928 PA / Raw
Ether / IP / TCP 192.168.0.145:46928 > 35.244.180.134:https A
Ether / IP / TCP 192.168.0.145:46928 > 35.244.180.134:https PA / Raw
Ether / IP / TCP 192.168.0.145:46928 > 35.244.180.134:https PA / Raw
Ether / IP / TCP 35.244.180.134:https > 192.168.0.145:46928 A
Ether / IP / TCP 35.244.180.134:https > 192.168.0.145:46928 A
Ether / IP / TCP 192.168.0.145:39882 > 20.42.65.90:https PA / Raw
Ether / IP / TCP 192.168.0.145:39882 > 20.42.65.90:https PA / Raw
Ether / IP / TCP 20.42.65.90:https > 192.168.0.145:39882 A
Ether / IP / TCP 20.42.65.90:https > 192.168.0.145:39882 PA / Raw
Ether / IP / TCP 192.168.0.145:39882 > 20.42.65.90:https A
Ether / IP / TCP 192.168.0.145:39882 > 20.42.65.90:https PA / Raw
Ether / IP / TCP 35.244.180.134:https > 192.168.0.145:46928 PA / Raw
Ether / IP / TCP 35.244.180.134:https > 192.168.0.145:46928 PA / Raw
Ether / IP / TCP 192.168.0.145:46928 > 35.244.180.134:https A
Ether / IP / TCP 20.42.65.90:https > 192.168.0.145:39882 A
Ether / IP / TCP 142.250.183.234:https > 192.168.0.145:53126 PA / Raw
Ether / IP / TCP 192.168.0.145:53126 > 142.250.183.234:https A
Ether / IP / TCP 192.168.0.145:53126 > 142.250.183.234:https PA / Raw
Ether / IP / TCP 192.168.0.145:53126 > 142.250.183.234:https PA / Raw
Ether / IP / TCP 142.250.183.234:https > 192.168.0.145:53126 A
Ether / IP / TCP 142.250.183.234:https > 192.168.0.145:53126 A
Ether / IP / TCP 35.244.180.134:https > 192.168.0.145:46928 PA / Raw
Ether / IP / TCP 35.244.180.134:https > 192.168.0.145:46928 PA / Raw
Ether / IP / TCP 35.244.180.134:https > 192.168.0.145:46928 PA / Raw
Ether / IP / TCP 35.244.180.134:https > 192.168.0.145:46928 PA / Raw
Ether / IP / TCP 192.168.0.145:46928 > 35.244.180.134:https A
Ether / IP / TCP 192.168.0.145:46928 > 35.244.180.134:https PA / Raw
Ether / IP / TCP 192.168.0.145:46928 > 35.244.180.134:https PA / Raw
Ether / IP / TCP 35.244.180.134:https > 192.168.0.145:46928 A
Ether / IP / TCP 35.244.180.134:https > 192.168.0.145:46928 A
Ether / IP / TCP 35.244.180.134:https > 192.168.0.145:46928 PA / Raw
Ether / IP / TCP 35.244.180.134:https > 192.168.0.145:46928 PA / Raw
Ether / IP / TCP 35.244.180.134:https > 192.168.0.145:46928 PA / Raw
Ether / IP / TCP 35.244.180.134:https > 192.168.0.145:46928 PA / Raw
Ether / IP / TCP 35.244.180.134:https > 192.168.0.145:46928 PA / Raw
Ether / IP / TCP 192.168.0.145:46928 > 35.244.180.134:https A
Ether / IP / TCP 192.168.0.145:46928 > 35.244.180.134:https PA / Raw
Ether / IP / TCP 192.168.0.145:46928 > 35.244.180.134:https PA / Raw
Ether / IP / TCP 35.244.180.134:https > 192.168.0.145:46928 PA / Raw
Ether / IP / TCP 192.168.0.145:46928 > 35.244.180.134:https A
Ether / IP / TCP 35.244.180.134:https > 192.168.0.145:46928 A
Ether / IP / TCP 35.244.180.134:https > 192.168.0.145:46928 A
Ether / IP / TCP 192.168.0.145:46928 > 35.244.180.134:https PA / Raw
Ether / IP / TCP 35.244.180.134:https > 192.168.0.145:46928 A
Ether / IP / TCP 35.244.180.134:https > 192.168.0.145:46928 PA / Raw
Ether / IP / TCP 35.244.180.134:https > 192.168.0.145:46928 PA / Raw
Ether / IP / TCP 192.168.0.145:46928 > 35.244.180.134:https A
Ether / IP / TCP 192.168.0.145:46928 > 35.244.180.134:https PA / Raw
Ether / IP / TCP 35.244.180.134:https > 192.168.0.145:46928 PA / Raw
Ether / IP / TCP 35.244.180.134:https > 192.168.0.145:46928 PA / Raw
Ether / IP / TCP 192.168.0.145:46928 > 35.244.180.134:https A
Ether / IP / TCP 192.168.0.145:46928 > 35.244.180.134:https PA / Raw
Ether / IP / TCP 192.168.0.145:46928 > 35.244.180.134:https PA / Raw
Ether / IP / TCP 35.244.180.134:https > 192.168.0.145:46928 A
Ether / IP / TCP 35.244.180.134:https > 192.168.0.145:46928 A
Ether / IP / TCP 192.168.0.145:56264 > 35.244.180.134:https PA / Raw
Ether / IP / TCP 192.168.0.145:56264 > 35.244.180.134:https PA / Raw
Ether / IP / TCP 35.244.180.134:https > 192.168.0.145:46928 PA / Raw
Ether / IP / TCP 35.244.180.134:https > 192.168.0.145:46928 PA / Raw
Ether / IP / TCP 192.168.0.145:46928 > 35.244.180.134:https A
Ether / IP / TCP 35.244.180.134:https > 192.168.0.145:56264 A
Ether / IP / TCP 35.244.180.134:https > 192.168.0.145:56264 A
Ether / IP / TCP 35.244.180.134:https > 192.168.0.145:56264 PA / Raw
Ether / IP / TCP 192.168.0.145:56264 > 35.244.180.134:https A
Ether / IP / TCP 35.244.180.134:https > 192.168.0.145:56264 PA / Raw
Ether / IP / TCP 192.168.0.145:56264 > 35.244.180.134:https A
Ether / IP / TCP 35.244.180.134:https > 192.168.0.145:56264 PA / Raw
Ether / IP / TCP 192.168.0.145:56264 > 35.244.180.134:https A
Ether / IP / TCP 35.244.180.134:https > 192.168.0.145:56264 PA / Raw
Ether / IP / TCP 192.168.0.145:56264 > 35.244.180.134:https A
Ether / IP / TCP 35.244.180.134:https > 192.168.0.145:56264 PA / Raw
Ether / IP / TCP 192.168.0.145:56264 > 35.244.180.134:https A
Ether / IP / TCP 35.244.180.134:https > 192.168.0.145:56264 PA / Raw
Ether / IP / TCP 192.168.0.145:56264 > 35.244.180.134:https A
Ether / IP / TCP 192.168.0.145:56264 > 35.244.180.134:https PA / Raw
Ether / IP / TCP 192.168.0.145:56264 > 35.244.180.134:https PA / Raw
Ether / IP / TCP 35.244.180.134:https > 192.168.0.145:56264 A
Ether / IP / TCP 35.244.180.134:https > 192.168.0.145:46928 PA / Raw
Ether / IP / TCP 35.244.180.134:https > 192.168.0.145:46928 PA / Raw
Ether / IP / TCP 192.168.0.145:46928 > 35.244.180.134:https A
Ether / IP / TCP 35.244.180.134:https > 192.168.0.145:46928 PA / Raw
Ether / IP / TCP 35.244.180.134:https > 192.168.0.145:46928 PA / Raw
Ether / IP / TCP 192.168.0.145:46928 > 35.244.180.134:https A
Ether / IP / TCP 35.244.180.134:https > 192.168.0.145:46928 PA / Raw
Ether / IP / TCP 35.244.180.134:https > 192.168.0.145:46928 PA / Raw
