Ether / IP / TCP 192.168.0.145:56092 > 65.9.112.103:https A

Ether / IP / TCP 65.9.112.103:https > 192.168.0.145:56092 A

Ether / IP / TCP 192.168.0.145:35206 > 35.244.233.98:https A

Ether / IP / TCP 35.244.233.98:https > 192.168.0.145:35206 A

Ether / IP / TCP 192.168.0.145:40992 > 142.250.196.77:https A

Ether / IP / TCP 192.168.0.145:44854 > 142.250.76.78:https A

Ether / IP / TCP 192.168.0.145:47346 > 20.207.73.85:https A

Ether / IP / TCP 192.168.0.145:44826 > 49.206.251.227:https A

Ether / IP / TCP 192.168.0.145:46832 > 142.250.77.99:https A

Ether / IP / TCP 192.168.0.145:33284 > 104.18.37.228:https A

Ether / IP / TCP 192.168.0.145:38006 > 140.82.114.22:https A

Ether / IP / TCP 192.168.0.145:47460 > 142.250.193.170:https A

Ether / IP / TCP 192.168.0.145:40996 > 142.250.196.77:https A

Ether / IP / TCP 192.168.0.145:37720 > 142.250.195.123:https A

Ether / IP / TCP 192.168.0.145:37214 > 20.207.73.82:https A

Ether / IP / TCP 192.168.0.145:44860 > 142.250.76.78:https A

Ether / IP / TCP 192.168.0.145:50418 > 172.217.163.174:https A

Ether / IP / TCP 192.168.0.145:59846 > 142.250.71.10:https A

Ether / IP / TCP 49.206.251.227:https > 192.168.0.145:44826 A

Ether / IP / TCP 104.18.37.228:https > 192.168.0.145:33284 A

Ether / IP / TCP 142.250.196.77:https > 192.168.0.145:40992 A

Ether / IP / TCP 142.250.76.78:https > 192.168.0.145:44854 A

Ether / IP / TCP 142.250.77.99:https > 192.168.0.145:46832 A

Ether / IP / TCP 142.250.193.170:https > 192.168.0.145:47460 A

Ether / IP / TCP 142.250.195.123:https > 192.168.0.145:37720 A

Ether / IP / TCP 142.250.196.77:https > 192.168.0.145:40996 A

Ether / IP / TCP 142.250.76.78:https > 192.168.0.145:44860 A

Ether / IP / TCP 172.217.163.174:https > 192.168.0.145:50418 A

Ether / IP / TCP 142.250.71.10:https > 192.168.0.145:59846 A

Ether / IP / TCP 20.207.73.85:https > 192.168.0.145:47346 A

Ether / IP / TCP 20.207.73.82:https > 192.168.0.145:37214 A

Ether / IP / TCP 140.82.114.22:https > 192.168.0.145:38006 A

Ether / IP / TCP 192.168.0.145:52322 > 142.250.205.238:https A

Ether / IP / TCP 192.168.0.145:60904 > 35.244.180.134:https A

Ether / IP / TCP 192.168.0.145:44842 > 49.206.251.227:https A

Ether / IP / TCP 192.168.0.145:47716 > 34.120.214.181:https A

Ether / IP / TCP 192.168.0.145:39856 > 172.217.163.202:https A

Ether / IP / TCP 192.168.0.145:56966 > 172.64.154.86:https A

Ether / IP / TCP 192.168.0.145:41604 > 142.250.196.22:https A

Ether / IP / TCP 142.250.205.238:https > 192.168.0.145:52322 A

Ether / IP / TCP 172.217.163.202:https > 192.168.0.145:39856 A

Ether / IP / TCP 142.250.196.22:https > 192.168.0.145:41604 A

Ether / IP / TCP 49.206.251.227:https > 192.168.0.145:44842 A

Ether / IP / TCP 172.64.154.86:https > 192.168.0.145:56966 A

Ether / IP / TCP 35.244.180.134:https > 192.168.0.145:60904 A

Ether / IP / TCP 34.120.214.181:https > 192.168.0.145:47716 A

Ether / IP / TCP 192.168.0.145:35042 > 18.161.246.39:https A

Ether / IP / TCP 192.168.0.145:46840 > 142.250.77.99:https A

Ether / IP / TCP 142.250.77.99:https > 192.168.0.145:46840 A

Ether / IP / TCP 18.161.246.39:https > 192.168.0.145:35042 A

Ether / IP / TCP 192.168.0.145:34472 > 142.250.196.163:https A

Ether / IP / TCP 192.168.0.145:33234 > 142.250.195.106:https A

Ether / IP / TCP 142.250.196.163:https > 192.168.0.145:34472 A

Ether / IP / TCP 142.250.195.106:https > 192.168.0.145:33234 A

Ether / IP / TCP 192.168.0.145:36840 > 142.250.196.42:https A

Ether / IP / TCP 142.250.196.42:https > 192.168.0.145:36840 A

Ether / IP / TCP 192.168.0.145:46410 > 142.250.77.174:https A

Ether / IP / TCP 142.250.77.174:https > 192.168.0.145:46410 A

Ether / IP / TCP 192.168.0.145:41782 > 140.82.113.26:https A

Ether / IP / TCP 140.82.113.26:https > 192.168.0.145:41782 A

Ether / IP / TCP 192.168.0.145:37898 > 54.212.28.78:https A

Ether / IP / TCP 54.212.28.78:https > 192.168.0.145:37898 A

Ether / IP / TCP 192.168.0.145:37594 > 106.51.32.142:https A

Ether / IP / TCP 192.168.0.145:37598 > 106.51.32.142:https A

Ether / IP / TCP 192.168.0.145:42332 > 106.51.32.144:https A

Ether / IP / TCP 192.168.0.145:42336 > 106.51.32.144:https A

Ether / IP / TCP 192.168.0.145:37896 > 54.212.28.78:https A

Ether / IP / TCP 54.212.28.78:https > 192.168.0.145:37896 A

