Ether / IP / TCP 192.168.0.105:56352 > 35.244.180.134:https S

Ether / IP / TCP 192.168.0.105:50012 > 35.244.180.134:https S

Ether / IP / TCP 192.168.0.105:39232 > 35.224.170.84:http S

Ether / IP / TCP 192.168.0.105:47096 > 65.9.112.78:https S

Ether / IP / TCP 192.168.0.105:53642 > 54.201.82.50:https S

Ether / IP / TCP 192.168.0.105:40056 > 35.244.180.134:https S

Ether / IP / TCP 192.168.0.105:53168 > 20.189.172.32:https S

Ether / IP / TCP 192.168.0.105:53176 > 20.189.172.32:https S

Ether / IP / TCP 192.168.0.105:53190 > 20.189.172.32:https S

Ether / IP / TCP 192.168.0.105:53192 > 20.189.172.32:https S

Ether / IP / TCP 192.168.0.105:53198 > 20.189.172.32:https S

Ether / IP / TCP 192.168.0.105:47994 > 185.125.190.18:http S

